{
  "$schema": "https://json-schema.org/draft/2020-12/schema",
  "$id": "https://schemas.runx.ai/runx/security/exact-cve-audit/v1.json",
  "x-runx-packet-id": "runx.security.exact_cve_audit.v1",
  "type": "object",
  "required": ["schema", "scanner_version", "generated_at", "target", "dependency_scope", "inventory", "findings", "result"],
  "properties": {
    "schema": { "const": "runx.security.exact_cve_audit.v1" },
    "scanner_version": { "type": "string", "minLength": 1 },
    "generated_at": { "type": "string", "minLength": 1 },
    "target": { "$ref": "#/$defs/target" },
    "dependency_scope": { "enum": ["direct-production", "all-installed"] },
    "inventory": {
      "type": "array",
      "items": { "$ref": "#/$defs/dependency" }
    },
    "findings": {
      "type": "array",
      "items": { "$ref": "#/$defs/finding" }
    },
    "result": {
      "type": "object",
      "required": ["exact_dependencies_queried", "affected_dependencies", "advisory_findings", "source", "source_url"],
      "properties": {
        "exact_dependencies_queried": { "type": "integer", "minimum": 0 },
        "affected_dependencies": { "type": "integer", "minimum": 0 },
        "advisory_findings": { "type": "integer", "minimum": 0 },
        "source": { "const": "OSV" },
        "source_url": { "type": "string", "format": "uri" }
      },
      "additionalProperties": true
    }
  },
  "$defs": {
    "target": {
      "type": "object",
      "required": ["name", "repo", "commit", "lockfile_url", "lockfile_sha256", "lockfile_version"],
      "properties": {
        "name": { "type": "string", "minLength": 1 },
        "repo": { "type": "string", "format": "uri" },
        "commit": { "type": "string", "pattern": "^[0-9a-fA-F]{40}$" },
        "lockfile_url": { "type": "string", "format": "uri" },
        "lockfile_sha256": { "type": "string", "pattern": "^[0-9a-f]{64}$" },
        "lockfile_version": { "type": "integer" }
      },
      "additionalProperties": true
    },
    "dependency": {
      "type": "object",
      "required": ["name", "version", "path", "direct", "development"],
      "properties": {
        "name": { "type": "string", "minLength": 1 },
        "version": { "type": "string", "minLength": 1 },
        "path": { "type": "string", "minLength": 1 },
        "direct": { "type": "boolean" },
        "development": { "type": "boolean" }
      },
      "additionalProperties": true
    },
    "finding": {
      "type": "object",
      "required": ["dependency", "exact_version", "advisory_id", "advisory_url", "exact_query"],
      "properties": {
        "dependency": { "type": "string", "minLength": 1 },
        "exact_version": { "type": "string", "minLength": 1 },
        "advisory_id": { "type": "string", "minLength": 1 },
        "advisory_url": { "type": "string", "format": "uri" },
        "exact_query": { "type": "object", "additionalProperties": true }
      },
      "additionalProperties": true
    }
  },
  "additionalProperties": true
}
