{
  "schema": "runx.security.exact_cve_audit.v1",
  "scanner_version": "0.1.1",
  "generated_at": "2026-07-15T00:46:07.066Z",
  "target": {
    "name": "OWASP NodeGoat",
    "repo": "https://github.com/OWASP/NodeGoat",
    "commit": "c5cb68a7084e4ae7dcc60e6a98768720a81841e8",
    "lockfile_url": "https://raw.githubusercontent.com/OWASP/NodeGoat/c5cb68a7084e4ae7dcc60e6a98768720a81841e8/package-lock.json",
    "lockfile_sha256": "b9ed49893a9d3bcf6fe567cd38fe8168850591e0018f19d3bb0d1f80a4c2eecc",
    "lockfile_version": 2
  },
  "dependency_scope": "direct-production",
  "inventory": [
    {
      "name": "bcrypt-nodejs",
      "version": "0.0.3",
      "path": "node_modules/bcrypt-nodejs",
      "direct": true,
      "development": false
    },
    {
      "name": "body-parser",
      "version": "1.18.3",
      "path": "node_modules/body-parser",
      "direct": true,
      "development": false
    },
    {
      "name": "consolidate",
      "version": "0.14.5",
      "path": "node_modules/consolidate",
      "direct": true,
      "development": false
    },
    {
      "name": "csurf",
      "version": "1.9.0",
      "path": "node_modules/csurf",
      "direct": true,
      "development": false
    },
    {
      "name": "dont-sniff-mimetype",
      "version": "1.0.0",
      "path": "node_modules/dont-sniff-mimetype",
      "direct": true,
      "development": false
    },
    {
      "name": "express",
      "version": "4.16.4",
      "path": "node_modules/express",
      "direct": true,
      "development": false
    },
    {
      "name": "express-session",
      "version": "1.15.6",
      "path": "node_modules/express-session",
      "direct": true,
      "development": false
    },
    {
      "name": "forever",
      "version": "2.0.0",
      "path": "node_modules/forever",
      "direct": true,
      "development": false
    },
    {
      "name": "helmet",
      "version": "2.3.0",
      "path": "node_modules/helmet",
      "direct": true,
      "development": false
    },
    {
      "name": "marked",
      "version": "0.3.5",
      "path": "node_modules/marked",
      "direct": true,
      "development": false
    },
    {
      "name": "mongodb",
      "version": "2.2.36",
      "path": "node_modules/mongodb",
      "direct": true,
      "development": false
    },
    {
      "name": "needle",
      "version": "2.2.4",
      "path": "node_modules/needle",
      "direct": true,
      "development": false
    },
    {
      "name": "node-esapi",
      "version": "0.0.1",
      "path": "node_modules/node-esapi",
      "direct": true,
      "development": false
    },
    {
      "name": "serve-favicon",
      "version": "2.5.0",
      "path": "node_modules/serve-favicon",
      "direct": true,
      "development": false
    },
    {
      "name": "swig",
      "version": "1.4.2",
      "path": "node_modules/swig",
      "direct": true,
      "development": false
    },
    {
      "name": "underscore",
      "version": "1.9.1",
      "path": "node_modules/underscore",
      "direct": true,
      "development": false
    }
  ],
  "findings": [
    {
      "dependency": "body-parser",
      "exact_version": "1.18.3",
      "dependency_path": "node_modules/body-parser",
      "direct": true,
      "development": false,
      "advisory_id": "GHSA-qwcr-r2fm-qrc7",
      "aliases": [
        "CVE-2024-45590"
      ],
      "summary": "body-parser vulnerable to denial of service when url encoding is enabled",
      "modified": "2026-02-04T03:23:13.937941Z",
      "published": "2024-09-10T15:52:39Z",
      "severity": [
        {
          "type": "CVSS_V3",
          "score": "CVSS:3.1/AV:N/AC:L/PR:N/UI:N/S:U/C:N/I:N/A:H"
        },
        {
          "type": "CVSS_V4",
          "score": "CVSS:4.0/AV:N/AC:L/AT:N/PR:N/UI:N/VC:N/VI:N/VA:H/SC:N/SI:N/SA:N"
        }
      ],
      "advisory_url": "https://osv.dev/vulnerability/GHSA-qwcr-r2fm-qrc7",
      "references": [
        {
          "type": "WEB",
          "url": "https://github.com/expressjs/body-parser/security/advisories/GHSA-qwcr-r2fm-qrc7"
        },
        {
          "type": "ADVISORY",
          "url": "https://nvd.nist.gov/vuln/detail/CVE-2024-45590"
        },
        {
          "type": "WEB",
          "url": "https://github.com/expressjs/body-parser/commit/b2695c4450f06ba3b0ccf48d872a229bb41c9bce"
        },
        {
          "type": "PACKAGE",
          "url": "https://github.com/expressjs/body-parser"
        }
      ],
      "exact_query": {
        "package": {
          "ecosystem": "npm",
          "name": "body-parser"
        },
        "version": "1.18.3"
      }
    },
    {
      "dependency": "express",
      "exact_version": "4.16.4",
      "dependency_path": "node_modules/express",
      "direct": true,
      "development": false,
      "advisory_id": "GHSA-qw6h-vgh9-j6wx",
      "aliases": [
        "CVE-2024-43796"
      ],
      "summary": "express vulnerable to XSS via response.redirect()",
      "modified": "2026-02-04T04:10:32.069920Z",
      "published": "2024-09-10T19:41:04Z",
      "severity": [
        {
          "type": "CVSS_V3",
          "score": "CVSS:3.1/AV:N/AC:H/PR:N/UI:R/S:U/C:L/I:L/A:L"
        },
        {
          "type": "CVSS_V4",
          "score": "CVSS:4.0/AV:N/AC:L/AT:P/PR:N/UI:P/VC:N/VI:N/VA:N/SC:L/SI:L/SA:L"
        }
      ],
      "advisory_url": "https://osv.dev/vulnerability/GHSA-qw6h-vgh9-j6wx",
      "references": [
        {
          "type": "WEB",
          "url": "https://github.com/expressjs/express/security/advisories/GHSA-qw6h-vgh9-j6wx"
        },
        {
          "type": "ADVISORY",
          "url": "https://nvd.nist.gov/vuln/detail/CVE-2024-43796"
        },
        {
          "type": "WEB",
          "url": "https://github.com/expressjs/express/commit/54271f69b511fea198471e6ff3400ab805d6b553"
        },
        {
          "type": "PACKAGE",
          "url": "https://github.com/expressjs/express"
        }
      ],
      "exact_query": {
        "package": {
          "ecosystem": "npm",
          "name": "express"
        },
        "version": "4.16.4"
      }
    },
    {
      "dependency": "express",
      "exact_version": "4.16.4",
      "dependency_path": "node_modules/express",
      "direct": true,
      "development": false,
      "advisory_id": "GHSA-rv95-896h-c2vc",
      "aliases": [
        "CVE-2024-29041"
      ],
      "summary": "Express.js Open Redirect in malformed URLs",
      "modified": "2026-02-04T02:13:10.821360Z",
      "published": "2024-03-25T19:40:26Z",
      "severity": [
        {
          "type": "CVSS_V3",
          "score": "CVSS:3.1/AV:N/AC:L/PR:N/UI:R/S:C/C:L/I:L/A:N"
        }
      ],
      "advisory_url": "https://osv.dev/vulnerability/GHSA-rv95-896h-c2vc",
      "references": [
        {
          "type": "WEB",
          "url": "https://github.com/expressjs/express/security/advisories/GHSA-rv95-896h-c2vc"
        },
        {
          "type": "ADVISORY",
          "url": "https://nvd.nist.gov/vuln/detail/CVE-2024-29041"
        },
        {
          "type": "WEB",
          "url": "https://github.com/koajs/koa/issues/1800"
        },
        {
          "type": "WEB",
          "url": "https://github.com/expressjs/express/pull/5539"
        },
        {
          "type": "WEB",
          "url": "https://github.com/expressjs/express/commit/0867302ddbde0e9463d0564fea5861feb708c2dd"
        },
        {
          "type": "WEB",
          "url": "https://github.com/expressjs/express/commit/0b746953c4bd8e377123527db11f9cd866e39f94"
        },
        {
          "type": "WEB",
          "url": "https://expressjs.com/en/4x/api.html#res.location"
        },
        {
          "type": "PACKAGE",
          "url": "https://github.com/expressjs/express"
        }
      ],
      "exact_query": {
        "package": {
          "ecosystem": "npm",
          "name": "express"
        },
        "version": "4.16.4"
      }
    },
    {
      "dependency": "marked",
      "exact_version": "0.3.5",
      "dependency_path": "node_modules/marked",
      "direct": true,
      "development": false,
      "advisory_id": "GHSA-5v2h-r2cx-5xgj",
      "aliases": [
        "CVE-2022-21681"
      ],
      "summary": "Inefficient Regular Expression Complexity in marked",
      "modified": "2023-11-08T04:08:07.532717Z",
      "published": "2022-01-14T21:04:46Z",
      "severity": [
        {
          "type": "CVSS_V3",
          "score": "CVSS:3.1/AV:N/AC:L/PR:N/UI:N/S:U/C:N/I:N/A:H"
        }
      ],
      "advisory_url": "https://osv.dev/vulnerability/GHSA-5v2h-r2cx-5xgj",
      "references": [
        {
          "type": "WEB",
          "url": "https://github.com/markedjs/marked/security/advisories/GHSA-5v2h-r2cx-5xgj"
        },
        {
          "type": "ADVISORY",
          "url": "https://nvd.nist.gov/vuln/detail/CVE-2022-21681"
        },
        {
          "type": "WEB",
          "url": "https://github.com/markedjs/marked/commit/8f806573a3f6c6b7a39b8cdb66ab5ebb8d55a5f5"
        },
        {
          "type": "WEB",
          "url": "https://github.com/markedjs/marked/commit/c4a3ccd344b6929afa8a1d50ac54a721e57012c0"
        },
        {
          "type": "PACKAGE",
          "url": "https://github.com/markedjs/marked"
        },
        {
          "type": "WEB",
          "url": "https://lists.fedoraproject.org/archives/list/package-announce@lists.fedoraproject.org/message/AIXDMC3CSHYW3YWVSQOXAWLUYQHAO5UX"
        }
      ],
      "exact_query": {
        "package": {
          "ecosystem": "npm",
          "name": "marked"
        },
        "version": "0.3.5"
      }
    },
    {
      "dependency": "marked",
      "exact_version": "0.3.5",
      "dependency_path": "node_modules/marked",
      "direct": true,
      "development": false,
      "advisory_id": "GHSA-7px7-7xjx-hxm8",
      "aliases": [
        "CVE-2017-1000427"
      ],
      "summary": "Marked vulnerable to XSS from data URIs",